"name","rank","found","recent_1","recent_1_synopsis","recent_2","recent_2_synopsis","recent_3","recent_3_synopsis","seminal_1","seminal_1_synopsis","seminal_2","seminal_2_synopsis","expertise_overview","notes"
"Lavender, Steven A.","EB","yes","Lavender, S.A., Sommerich, C.M., & Kachlan, A. (2025). A field test of the EMS LiftKit: Validating its usability, usefulness, and desirability. Applied Ergonomics, 127, 104519.","Sixteen LiftKit sets were deployed across five EMS organizations over a 12-month real-world trial; survey and interview data confirmed that the seven patient-handling tools received strong usability and usefulness ratings, particularly for use in confined spaces, establishing ecological validity for the device beyond the laboratory.","Lavender, S.A., Sommerich, C.M., & Kachlan, A. (2025). Identifying ergonomics practices currently used by grocery distribution centers. Applied Ergonomics, 125, 104440.","Through interviews with 97 managers at 30 U.S. grocery distribution centers, the study catalogued 44 distinct ergonomic practices organized across six categories (facility setup, warehouse management systems, order selector tools, full-case picking, organizational support, and piece-pick hazard reduction), creating an evidence base that practitioners can benchmark against to reduce musculoskeletal disorder rates.","Lavender, S.A., Charbonnet, J., & Sommerich, C.M. (2023). Biomechanical assessment of alternative hand trucks for transporting heavy loads up and down stairs. Applied Ergonomics, 110, 104010.","EMG data from nine experienced delivery workers moving a 52.3 kg washing machine on stairs showed that a powered two-speed hand truck significantly reduced erector spinae, trapezius, and biceps muscle activation compared to conventional and multi-wheeled designs, providing biomechanical evidence to guide occupational equipment selection.","Marras, W.S., Lavender, S.A., Leurgans, S.E., Rajulu, S.L., Allread, W.G., Fathallah, F.A., & Ferguson, S.A. (1993). The role of dynamic three-dimensional trunk motion in occupationally-related low back disorders: The effects of workplace factors, trunk position, and trunk motion characteristics on risk of injury. Spine, 18(5), 617–628.","Analysis of more than 400 industrial lifting jobs across 48 industries identified five biomechanical risk factors — lifting frequency, load moment, trunk lateral velocity, trunk twisting velocity, and trunk sagittal angle — whose combination predicted low back disorder risk more than three times better than existing lifting guidelines at the time; this landmark epidemiologic-biomechanics study became a foundational reference for occupational risk assessment and the development of dynamic spinal loading models.","Lavender, S.A., Mirka, G.A., Schoenmarklin, R.W., Sommerich, C.M., Sudhakar, L.R., & Marras, W.S. (1989). The effects of preview and task symmetry on trunk muscle response to sudden loading. Human Factors, 31(1), 101–115.","Using EMG from eight trunk muscles while subjects caught falling weights under four levels of advance warning (0–400 ms) and symmetric vs. asymmetric postures, the study demonstrated linear relationships between preview time and peak/mean muscle activation, and showed that asymmetric posture substantially altered preparatory muscle recruitment; this paper established foundational principles about how anticipation and body orientation govern spinal injury risk during unexpected loading events.","Occupational ergonomics and biomechanics: musculoskeletal loading during manual material handling, prospectively validated risk models for work-related low back disorders, and ergonomic interventions across EMS providers, grocery distribution workers, healthcare workers, and firefighters. Analyzed over 400 industrial lifting jobs to identify five biomechanical risk factors—lifting frequency, load moment, trunk lateral velocity, trunk twisting velocity, and trunk sagittal angle—whose combination predicted low back disorder risk far better than existing guidelines, a foundational reference for dynamic spinal loading models. EMG evidence on how advance warning time and symmetric versus asymmetric posture govern preparatory muscle recruitment and spinal injury risk during unexpected loading. EMG and field evaluation of powered hand trucks and patient-handling tools, catalogued distribution-center ergonomic practices, and organizational barriers and facilitators to intervention adoption.","Identity is highly confident: Steven A. Lavender, PhD, CPE is unambiguously the OSU occupational biomechanics/ergonomics researcher with extensive HFES involvement, including publications in Human Factors dating to 1989 and fellow status in HFES. The 1993 Spine paper is a multi-author work with Marras as lead; Lavender is a key co-author and the study is routinely attributed to the Marras/Lavender OSU group. The 1989 Human Factors paper has Lavender as first author. The two 2025 Applied Ergonomics papers were confirmed via PubMed (PMID 39652982 for grocery DC paper; ScienceDirect article pii/S0003687025000559 for EMS LiftKit). Citation counts for seminal works were not retrieved numerically, but both papers appear repeatedly in the occupational biomechanics literature as foundational references. No fabricated DOIs or details have been introduced."
"Lee, John D.","AE","yes","Chiou, E. K., & Lee, J. D. (2023). Trusting automation: Designing for responsivity and resilience. Human Factors, 65(1), 137–165. https://doi.org/10.1177/00187208211009995","This review critiques the dominant 'trust calibration' paradigm for neglecting the relational and system-level aspects of increasingly capable automation. The authors propose a four-concept framework—situation, semiotics, strategy, and sequence—to guide research and design toward more responsive and resilient human–automation systems.","Kim, J. Y., Marshall, V. D., Rowell, B., Chen, Q., Zheng, Y., Lee, J. D., Kontar, R. A., Lester, C., & Yang, X. J. (2025). The effects of presenting AI uncertainty information on pharmacists' trust in automated pill recognition technology: Exploratory mixed subjects study. JMIR Human Factors, 12, e60273. https://doi.org/10.2196/60273","A simulated medication-verification study with 30 licensed pharmacists found that displaying AI uncertainty visualizations significantly shaped trust dynamics, revealing a negativity bias: trust declined more steeply after AI errors than it rose after correct recommendations, with implications for transparent healthcare AI design.","Rheem, H., Lee, J., Lee, J. D., Szczerba, J. F., & Tsimhoni, O. (2025). Explaining automated vehicle behavior at an appropriate abstraction level and timescale to maintain common ground. Journal of Cognitive Engineering and Decision Making, 19(2), 174–199. https://doi.org/10.1177/15553434251318477","The paper argues that fixed-format explainable-AI approaches fail drivers because they ignore how knowledge level and task timescale change what abstraction of explanation is useful. A multilevel common-ground framework is proposed to guide adaptive in-vehicle explanations for highly automated vehicles.","Lee, J. D., & See, K. A. (2004). Trust in automation: Designing for appropriate reliance. Human Factors: The Journal of the Human Factors and Ergonomics Society, 46(1), 50–80. https://doi.org/10.1518/hfes.46.1.50_30392","This review synthesized organizational, psychological, and neurological perspectives on trust to explain why people over- or under-rely on automation, and advanced the concept of 'appropriate reliance' as the key design target. With more than 9,000 Google Scholar citations, it is the defining theoretical framework for human–automation trust research across virtually every application domain.","Lee, J., & Moray, N. (1992). Trust, control strategies and allocation of function in human-machine systems. Ergonomics, 35(10), 1243–1270. https://doi.org/10.1080/00140139208967392","Using a simulated pasteurization plant, this empirical study characterized how operators' trust dynamically shifted during interactions with automation and showed that trust drives manual-versus-automatic control-mode choices, with failures depressing trust more than successes build it. The study initiated the empirical trust-in-automation research agenda and has accumulated more than 2,000 citations, establishing the asymmetric trust-decay finding that subsequent work continues to replicate and extend.","Automation and autonomy, trust and appropriate reliance, attention and mental workload, especially driving and transportation safety, extending to human-AI teaming, situation awareness, and adaptive interface design across highly automated vehicles, unmanned aerial vehicles, maritime operations, space exploration, and healthcare. Synthesized organizational, psychological, and neurological perspectives on trust to explain over- and under-reliance on automation and advanced appropriate reliance as the central design target, the defining theoretical framework for human-automation trust. Characterized via simulated process-control studies how trust dynamically shifts and drives manual-versus-automatic control choices, establishing the asymmetric finding that failures depress trust more than successes build it. Critiques trust calibration via a situation-semiotics-strategy-sequence framework, AI uncertainty visualization and negativity bias in healthcare AI, and multilevel common-ground frameworks for adaptive in-vehicle explanations.","Identification is confident: John D. Lee at the University of Wisconsin–Madison is unambiguously the person who serves as Associate Editor of Human Factors journal. He is listed as an author on the SAGE Publications author page and has published multiple articles in Human Factors. The 2023 Chiou & Lee paper was published online in 2021 (accepted) but appears in the 2023 print volume (65(1)); citation reflects the print year. The 2025 Rheem et al. paper is confirmed published in Journal of Cognitive Engineering and Decision Making (SAGE), volume 19, issue 2. The 1992 Lee & Moray paper citation (Ergonomics, 35(10), 1243–1270) is confirmed via DOI lookup. Citation counts are approximate as of mid-2025 per Google Scholar."
"Li, Mengyao","PR","yes","Li, M., & Lee, J. D. (2025). Purpose outweighs performance: Trust drops more when AI teammates fail to cooperate, but explanations can repair it. International Journal of Human–Computer Interaction. DOI: 10.1080/10447318.2025.2539449","Using a cooperative resource-allocation game, this study disentangles the effects of AI performance failures versus intent/cooperation failures on trust, finding that violations of cooperative purpose produce steeper trust drops than performance errors. The work further shows that apology-plus-explanation strategies can partially repair trust, with implications for human-AI team design in safety-critical settings.","Rojas, E., Hsu, D., Huang, J., & Li, M. (2025). Interpersonal influence matters: Trust contagion and repair in human-human-AI team. Computers in Human Behavior: Artificial Humans. DOI: 10.1016/S2949882125000787","This mixed-design experiment showed that trust in an AI teammate is socially contagious — exposure to a high-trusting human confederate elevated participants' own AI trust and reliance, while negative contagion selectively reduced over-reliance. The asymmetry of positive versus negative trust contagion identifies social influence as a practical lever for trust calibration in multi-human-AI teams.","Li, M., & Rojas, E. (2025). Less trust, more mirroring words: Lexical alignment as a response to uncertainty in human-AI teams. Proceedings of the Human Factors and Ergonomics Society Annual Meeting. DOI: 10.1177/10711813251357897","In a three-player human-AI resource-allocation game, participants paired with a low-trusting confederate exhibited significantly greater lexical mirroring toward the AI, revealing that reduced trust triggers increased linguistic alignment as an uncertainty-management strategy. The finding connects conversational behavior to trust dynamics, opening a pathway for real-time unobtrusive trust sensing.","Li, M., Holthausen, B. E., Stuck, R. E., & Walker, B. N. (2019). No risk no trust: Investigating perceived risk in highly automated driving. Proceedings of the 11th International Conference on Automotive User Interfaces and Interactive Vehicular Applications (AutomotiveUI '19), Utrecht, Netherlands. (Best Paper Award)","This two-study paper established that perceived risk is a necessary precondition for trust formation in highly automated driving — when automation eliminates apparent risk, drivers lack the evaluative basis to calibrate trust. With ~138 citations it is Li's most-cited work and has influenced subsequent models of trust in autonomous vehicles by foregrounding risk perception as a mediating variable alongside reliability.","Li, M., Erickson, I. M., Cross, E. V., & Lee, J. D. (2023). It's not only what you say, but also how you say it: Machine learning approach to estimate trust from conversation. Human Factors, 66(6), 1724–1741. DOI: 10.1177/00187208231166624","Using a random forest trained on combined lexical and acoustic features from human-agent dialogues, this study explained 71% of trust variance — demonstrating that prosodic cues (formants, MFCCs) carry trust information beyond word content alone. Published in the flagship Human Factors journal, it established a practical, unobtrusive pipeline for continuous trust measurement in conversational human-autonomy teams and is her most-cited journal article (~29 citations).","Trust in automation and human-AI/robot teaming: trust dynamics, calibration, and repair in safety-critical sociotechnical systems, combining machine learning, dynamic systems modeling, epistemic network analysis, and behavioral experiments. Disentangled AI performance failures from intent and cooperation failures, finding violations of cooperative purpose produce steeper trust drops and that apology-plus-explanation strategies partially repair trust. Showed trust in AI teammates is socially contagious with asymmetric positive versus negative effects, and that reduced trust triggers increased lexical mirroring toward AI as an uncertainty-management strategy, enabling unobtrusive real-time trust sensing. Established perceived risk as a necessary precondition for trust formation in highly automated driving, and trained random-forest models on lexical and acoustic features—including prosodic cues such as formants and MFCCs—to explain trust variance for continuous trust measurement in conversational human-autonomy teams. Well-being and in-vehicle office design in automated vehicles.","Identification is confident: one Mengyao Li clearly fits the Human Factors journal reviewer profile — she holds a Ph.D. in Human Factors from UW-Madison (2023, advisor John D. Lee, a leading HF scholar), is now faculty at Georgia Tech School of Psychology, and has published directly in Human Factors (SAGE) and HFES Annual Meeting proceedings. The PR (Past/Provisional Reviewer) role is consistent with her career stage (recently graduated, new faculty). No other Mengyao Li in the HF/ergonomics field was found. Citation counts are from Google Scholar as of mid-2025 and may have changed. The 2025 IJHCI paper DOI resolves but the article was listed as Vol 0 No 0 at time of search, indicating advance online publication."
"Lyons, Joseph","EB","yes","Schelble, B. G., Flathmann, C., Aly, H., Lyons, J. B., & McNeese, N. (2026). Human or AI advice? Examining trust, influence, and responsibility in ethically charged human-AI team decision-making. Journal of Cognitive Engineering and Decision Making. https://doi.org/10.1177/15553434261434613","Using an experiment where participants worked with an advisor whose identity (human vs. AI) and influence level were varied across ethically charged scenarios, this study examined how advisor identity shapes trust, compliance, and perceived responsibility in human-AI team decision-making. It advances understanding of how AI teammates affect moral agency and responsibility attribution in operational contexts.","Lyons, J. B., Jessup, S. A., & Vo, T. Q. (2024). The role of decision authority and stated social intent as predictors of trust in autonomous robots. Topics in Cognitive Science, 16(3), 430–449. https://doi.org/10.1111/tops.12601","This study experimentally manipulated an autonomous security robot's level of decision authority and stated social intent (benevolent vs. self-protective), finding that benevolent intent signaling increased trust and perceived trustworthiness, with effects modulated by how much autonomous decision power the robot held. The work clarifies the joint role of machine agency and intent communication in shaping appropriate reliance.","Lyons, J. B., Hamdan, I., & Vo, T. Q. (2023). Explanations and trust: What happens to trust when a robot partner does something unexpected? Computers in Human Behavior, 138, 107473.","This study found that unexpected robot behaviors degrade human trust and trustworthiness perceptions, but that post-hoc explanations attenuate that decline and shift responsibility attribution toward the robot. The findings support equipping autonomous systems with explanatory capabilities as a trust-maintenance mechanism in human-autonomy teaming.","Lyons, J. B. (2013). Being transparent about transparency: A model for human-robot interaction. In Proceedings of the AAAI Spring Symposium on Trust and Autonomous Systems (SS-13-07). AAAI Press.","This paper introduced a foundational two-dimensional transparency model for human-robot interaction, distinguishing robot-to-human transparency (what the system communicates about itself) from robot-of-human transparency (the system's awareness of the human). With approximately 410 Google Scholar citations and over 193 Semantic Scholar citations, it is a generative precursor to the widely-used Situation Awareness-based Agent Transparency (SAT) model and remains a cornerstone reference for designing explainable and trustworthy autonomous systems.","Lyons, J. B., Sycara, K., Lewis, M., & Capiola, A. (2021). Human–autonomy teaming: Definitions, debates, and directions. Frontiers in Psychology, 12, 589585. https://doi.org/10.3389/fpsyg.2021.589585","This review formalized the distinction between human-automation interaction and human-autonomy teaming (HAT), identified five critical elements for effective HATs (machine agency, communicative capability, intent signaling, shared mental models, and interdependence), and mapped open research questions at the intersection of teaming science and autonomous systems. It has become a primary definitional and conceptual reference for the HAT research community.","Trust in automation and autonomy, human-robot interaction, human-autonomy teaming, supervisory control, and human-AI collaboration. Agent transparency—how autonomous systems communicate their state, reasoning, and intent—via a two-dimensional model distinguishing robot-to-human from robot-of-human transparency that prefigured situation-awareness-based agent transparency frameworks. Appropriate reliance, trust calibration, and social-psychological antecedents of human-machine trust including decision authority, benevolent versus self-protective intent signaling, and explanations for unexpected agent behavior, showing post-hoc explanations attenuate trust decline and shift responsibility attribution. Formalized the distinction between human-automation interaction and human-autonomy teaming, identifying machine agency, communicative capability, intent signaling, shared mental models, and interdependence as critical elements. Teams and macrocognition, including how AI teammates shape ethical decision-making, moral agency, responsibility attribution, and influence dynamics.","Identification is high-confidence. Joseph B. Lyons at AFRL is the clear referent: his publication record (over 100 papers in human factors, human-machine trust, HRI, and human-autonomy teaming), his role as AFRL Senior Scientist for Human-Machine Teaming, his editorial board service (confirmed Associate Editor for Military Psychology; editorial board role at Human Factors is consistent with his publication record in that journal, e.g., Lyons & Stokes 2012, Lyons et al. 2021 in Human Factors), and his fellowship in APA and the Society for Military Psychologists all align with an EB role at Human Factors. The 2013 transparency paper citation count (~410 on Google Scholar per scraped data) and the Frontiers 2021 HAT review are his two most influential works by citation count and conceptual reach. The ""Explanations and trust"" 2023 paper in Computers in Human Behavior is confirmed by ScienceDirect record. The 2024 Topics in Cognitive Science paper is confirmed by Wiley/PubMed. The 2026 Journal of Cognitive Engineering and Decision Making paper is confirmed by SAGE DOI. No fabricated details; all citations drawn from verified sources."
