"name","rank","found","recent_1","recent_1_synopsis","recent_2","recent_2_synopsis","recent_3","recent_3_synopsis","seminal_1","seminal_1_synopsis","seminal_2","seminal_2_synopsis","expertise_overview","notes"
"Acosta-Sojo, Yadrianna","PR","yes","Outlaw, L., Acosta-Sojo, Y., Schall, M. C., Purdy, G. T., & Sesek, R. F. (2025). Comparing the effects of user preference and experience when using passive low back exoskeletons on physical and cognitive load while performing simulated manufacturing tasks. Proceedings of the Human Factors and Ergonomics Society Annual Meeting. DOI: 10.1177/10711813251369813","This study evaluated how user preference and training experience interact with passive low-back exoskeleton use during simulated manufacturing work, measuring both physical (biomechanical/EMG) and cognitive load outcomes. It provides empirical guidance on fitting and adoption strategies for occupational exoskeletons by examining whether preferred devices actually reduce combined physical and cognitive demands.","Stirling, L., Acosta-Sojo, Y., & Dennerlein, J. T. (2024). Defining a systems framework for characterizing physical work demands with wearable sensors. Annals of Work Exposures and Health, 68(5), 443–465. DOI: 10.1093/annweh/wxae024","The paper proposes an organizing systems-level framework that guides researchers and practitioners in selecting and deploying wearable sensors (IMUs, heart rate monitors, surface EMG) to measure physical job demands across different levels of analysis. The framework is intended to support exposure assessment research linking workplace conditions to musculoskeletal disorder risk.","Thaper, R., Sesek, R., Garnett, R., Acosta-Sojo, Y., & Purdy, G. T. (2023). The combined impact of hand-arm vibration and noise exposure on hearing sensitivity of agricultural/forestry workers—a systematic literature review. International Journal of Environmental Research and Public Health, 20(5), 4276. DOI: 10.3390/ijerph20054276","This systematic review of 18 peer-reviewed articles examined how simultaneous exposure to hand-arm vibration (HAV) and occupational noise compounds hearing loss in agricultural and forestry workers, identifying an additive effect on temporary threshold shifts likely mediated by vibration-induced cochlear vasospasm. The review highlights a population underserved by OSHA protections and points to combined-hazard assessment as a priority for occupational health surveillance.","Peng, X., Acosta-Sojo, Y., Wu, M. I., & Stirling, L. (2022). Actuation timing perception of a powered ankle exoskeleton and its associated ankle angle changes during walking. IEEE Transactions on Neural Systems and Rehabilitation Engineering, 30, 869–877. DOI: 10.1109/TNSRE.2022.3162213","This paper quantified how accurately users perceive the timing of actuation events in a powered ankle exoskeleton and how those perceptions correlate with measured ankle kinematics during walking. It is her most-cited work (45 citations) and is influential for establishing perceptual benchmarks needed to design intuitive human-exoskeleton control interfaces.","Acosta-Sojo, Y., & Stirling, L. (2022). Individuals differ in muscle activation patterns during early adaptation to a powered ankle exoskeleton. Applied Ergonomics, 98, 103593. DOI: 10.1016/j.apergo.2021.103593","This study documented substantial inter-individual variability in lower-limb muscle activation during the first exposures to a powered ankle exoskeleton, demonstrating that a single universal control strategy is insufficient for all users. With 33 citations it is foundational for personalizing exoskeleton assistance and for understanding the human-in-the-loop adaptation process.","Occupational human factors; wearable assistive technology and human-exoskeleton interaction—how users perceive, adapt to, and are physically and cognitively burdened by powered and passive exoskeletons in manufacturing and rehabilitation. Passive low-back and powered ankle exoskeletons, linking user preference, training experience, and combined biomechanical/EMG and cognitive load outcomes to fitting and adoption. Perceptual accuracy of exoskeleton actuation timing and inter-individual variability in lower-limb muscle activation, motivating personalized human-in-the-loop assistance. Surface EMG, inertial measurement, and observation-based exposure assessment within a systems-level wearable-sensor framework gauging physical work demands and musculoskeletal disorder risk. Sensorimotor proprioception and aging; combined-hazard exposure to hand-arm vibration and occupational noise.","Identification is confident: Acosta-Sojo is a named PR (Past/Provisional Reviewer) for Human Factors and is an active member of HFES (profile on connect.hfes.org). Her Google Scholar profile (user=Mg3K5a4AAAAJ) and Auburn University faculty page confirm affiliation and publication record. Citation counts are drawn from her Google Scholar profile as of mid-2025 and may have updated since. The 2026 Applied Ergonomics article on shoulder exoskeletons (listed on her Scholar profile) could not be independently verified with a live DOI fetch; it was therefore not included in the recent publications to avoid a potentially unconfirmed citation. The HFES Annual Meeting 2025 paper on low back exoskeletons was published via SAGE (DOI confirmed from the SAGE abstract page URL, though the full page rendered the SAGE homepage rather than the article during fetch)."
"Alsaid, Areen","PR","yes","Alkurdi, D., & Alsaid, A. (2025). Trust in Level 3 Automated Vehicles: A Systematic Literature Review. Proceedings of the Human Factors and Ergonomics Society Annual Meeting. https://doi.org/10.1177/10711813251369499","A PRISMA-guided synthesis of 80 empirical studies on trust in SAE Level 3 automated vehicles, identifying six key categories (automation features, environment, driver characteristics, HMI design, non-driving tasks, and training) that shape trust formation and measurement. The review maps the unique trust challenges posed by the Level 3 handover paradigm, in which drivers must alternate between passive monitoring and active control.","Alsaid, A., Alkurdi, D., Rasouli, S., Talamonti, W. J., & Nasir, M. (2024). From Categorical to Dimensional: A Multifaceted Approach to Emotions. Proceedings of the Human Factors and Ergonomics Society Annual Meeting. https://doi.org/10.1177/10711813241262446","Using 238 participants rating AI-generated images of driving scenarios with both Plutchik's Wheel and the Self-Assessment Manikin, the study maps categorical emotion labels onto dimensional valence-arousal space to compare and integrate the two frameworks. The work informs richer, more nuanced in-vehicle emotion monitoring by showing how the two paradigms relate and where they diverge.","Alsaid, A., & Li, M., Chiou, E. K., & Lee, J. D. (2023). Measuring trust: A text analysis approach to compare, contrast, and select trust questionnaires. Frontiers in Psychology, 14, 1192020. https://doi.org/10.3389/fpsyg.2023.1192020","Applies GloVe word-embedding text analysis to quantify the semantic relationships among items across major trust questionnaires, enabling researchers to compare construct coverage and select instruments suited to their application domain. An accompanying web app lets users explore the semantic space of trust scales, providing practical guidance for trust measurement in human-automation research.","Alsaid, A., Lee, J. D., & Price, M. (2020). Moving Into the Loop: An Investigation of Drivers' Steering Behavior in Highly Automated Vehicles. Human Factors, 62(4), 671-683. https://doi.org/10.1177/0018720819850283","Introduces 'vicarious steering' — spontaneous steering inputs made by drivers while automation is engaged — as a behavioral indicator of driver engagement and situational readiness in highly automated vehicles. Published in Human Factors itself, the paper shows that an adaptive algorithm can promote this behavior, with implications for automation design and takeover-transition safety.","Zhou, F., Alsaid, A., Blommer, M., Curry, R., Swaminathan, R., Kochhar, D. S., Talamonti, W., Tijerina, L., & Lei, B. (2020). Driver fatigue transition prediction in highly automated driving using physiological features. Expert Systems with Applications, 147, 113204. https://doi.org/10.1016/j.eswa.2020.113204","Develops a machine-learning pipeline using physiological signals (with PERCLOS as ground truth) to predict the onset of driver fatigue before it manifests, rather than detecting it reactively, which is critical for safe takeover requests in highly automated driving. Cited approximately 141 times, this work is the most-cited output in Alsaid's career and is widely referenced in the driver-monitoring and automated-vehicle literature.","Affective computing, driver-state estimation, and human-automation interaction in driving/transportation. Trust and reliance in automated vehicles, driver workload and engagement, emotion recognition, empathic in-vehicle interfaces, displays and controls for SAE Level 2-3 automation. PRISMA review of trust in Level 3 automated vehicles identifying automation features, environment, driver characteristics, HMI design, non-driving tasks, and training as trust determinants under the handover paradigm. Maps categorical and dimensional emotion frameworks for in-vehicle emotion monitoring; word-embedding text analysis comparing trust questionnaires. Introduced 'vicarious steering' as a behavioral indicator of driver engagement and readiness; machine-learning pipelines using physiological signals to predict driver fatigue onset before manifestation, supporting safe takeover requests and driver monitoring.","Identification is confident: Alsaid's prior collaboration with John D. Lee (a longtime Human Factors editor and HFES figure) and her publication record in the HFES Annual Meeting proceedings and directly in the Human Factors journal strongly support her role as a Past/Provisional Reviewer for that journal. The 2024 HFES paper listed the first author as Alkurdi et al. with Alsaid as last/senior author; citation count for the 2020 Expert Systems paper (~141) is drawn from Google Scholar as reported in the WebFetch result and may differ slightly from current counts. The 2025 HFES papers were in conference proceedings (not yet assigned volume/page numbers in the search results retrieved)."
"Armstrong, Thomas J.","EB","yes","Fu, A. Q., Shih, A. J., & Armstrong, T. J. (2023). Examination of the prediction of the planar piecewise continuous lumped muscle parameter model for walking gait with ankle-foot orthosis. Medical Engineering & Physics.","This paper evaluated a biomechanical gait model (PPCLMP) for predicting walking patterns in individuals using ankle-foot orthoses. It extended prior work on simple, clinically deployable models that use inertial sensors or video to estimate lower-limb mechanics, with relevance to rehabilitation ergonomics and assistive device design.","Carrasquillo, V., Armstrong, T. J., & Hu, S. J. (2022). Field observation of hospital food service workers and the relationship between customer demand and biomechanical stress: A case study. IISE Transactions on Occupational Ergonomics and Human Factors, 10(1), 47–58.","Using video-based motion analysis of hospital kitchen workers, this study found that increased customer demand reduced recovery time by 18% and raised hand activity level (HAL) by 27%, without changing reaching posture, demonstrating how workload variability elevates musculoskeletal risk in healthcare service workers.","Fu, Q. A., Simeonov, P., Hsiao, H., Woolley, C., & Armstrong, T. J. (2022). Selected movement and force pattern differences in rail- and rung-climbing of fire apparatus aerial ladders at 52.5° slope. Applied Ergonomics, 99, 103639.","This study compared hand and foot movement and force patterns for firefighters using rail-climbing vs. rung-climbing techniques on aerial ladders, finding that rail-climbing provided better body-position control and faster ascent/descent speeds, with implications for ladder design standards and firefighter safety.","Silverstein, B. A., Fine, L. J., & Armstrong, T. J. (1987). Occupational factors and carpal tunnel syndrome. American Journal of Industrial Medicine, 11(3), 343–358.","This landmark cross-sectional study of 652 industrial workers established a dose-response relationship between hand force and repetitiveness and carpal tunnel syndrome prevalence, with odds ratios exceeding 15 for high-force, high-repetitiveness jobs compared to low-exposure jobs. It became foundational evidence for occupational exposure standards and is among the most cited papers in occupational ergonomics with approximately 1,500 citations.","Armstrong, T., Buckle, P., Fine, L. J., Hagberg, M., Jonsson, B., Kilbom, A., Kuorinka, I. A., Silverstein, B. A., Sjogaard, G., & Viikari-Juntura, E. R. (1993). A conceptual model for work-related neck and upper-limb musculoskeletal disorders. Scandinavian Journal of Work, Environment & Health, 19(2), 73–84.","This internationally co-authored paper proposed a cascading dose-response framework linking workplace exposures (force, repetition, posture, vibration) through tissue-level dose to musculoskeletal disorder outcomes, explicitly incorporating capacity, adaptation, and modifying factors. With approximately 1,300 citations, it became the conceptual scaffold for research programs and risk-assessment tools worldwide.","Occupational ergonomics and biomechanics; analysis and prevention of work-related musculoskeletal disorders of the hand, wrist, and upper extremity. Hand grip force, tendon mechanics, upper-limb exposure assessment; task analysis and job design methods including hand activity level metrics and threshold limit value frameworks. Established a dose-response relationship between hand force, repetitiveness, and carpal tunnel syndrome prevalence, and a cascading dose-response framework linking workplace exposures (force, repetition, posture, vibration) through tissue-level dose to musculoskeletal outcomes, incorporating capacity, adaptation, and modifying factors. Video-based motion analysis of healthcare service work, showing workload variability elevates hand activity and reduces recovery time. Surgical and food-service worker biomechanics, firefighter ladder-climbing technique and design, fall prevention, and biomechanical gait modeling for ankle-foot orthoses.","Identification is highly confident: there is a single Thomas J. Armstrong in the ergonomics/human factors field — a University of Michigan professor with a 2025 Festschrift in IISE Transactions on Occupational Ergonomics and Human Factors, HFES Fellowship, and a Google Scholar profile (user=i0B8_icAAAAJ) showing 20,600+ citations. The 2023 gait-model paper (Medical Engineering & Physics) is confirmed via PubMed (PMID retrieved from PubMed filtered search). The 2022 IISE Transactions paper is confirmed via DOI 10.1080/24725838.2021.2018372. The 2022 Applied Ergonomics paper is confirmed via PubMed (PMID 34753097). The two seminal papers are confirmed via PubMed (PMID 3578290 for Silverstein 1987; PMID 8316782 for Armstrong 1993 conceptual model). Armstrong retired from active teaching around 2007 but continued research; the Festschrift (2025) notes his recent retirement from the University. No volume/page details were obtainable for the 2023 Medical Engineering & Physics paper from open sources, so that sub-field is omitted from the citation rather than fabricated."
"Bell, Herbert H.","EB","yes","Bennett, W., Schreiber, B., Portrey, A.M., & Bell, H.H. (2013). Challenges in transforming military training: Research and application of advanced simulation and training technologies and methods. Military Psychology, 25(3), 173–176. https://doi.org/10.1037/mil0000002","This introductory article to a special issue of Military Psychology, co-authored by Bell from the AFRL 711th Human Performance Wing, frames the ongoing challenge of translating simulation-based training science into operational practice; it emphasizes empirical evaluation of distributed mission operations training and mission-essential-competency-based syllabi as key transformation levers.","Covas-Smith, C.M., & Bell, H.H. (2011). Network latency and perceived fidelity of motion in a networked flight simulator. Proceedings of the Human Factors and Ergonomics Society Annual Meeting, 55(1), 1529–1532.","The paper examines how varying degrees of network latency degrade pilots' perceived fidelity of motion in a networked distributed flight simulator, providing empirical guidance for acceptable latency thresholds in Distributed Mission Operations (DMO) training environments.","Bell, H.H. (2005). Can PC-based systems enhance teamwork in the cockpit? International Journal of Aviation Psychology, 15(2). https://doi.org/10.1207/s15327108ijap1502_4","Bell reviews a decade of aircrew coordination studies conducted in low-cost PC-based flight simulations and presents new experimental results, providing evidence for the ecological validity of desktop simulators and offering practitioner guidelines for maximising simulation fidelity in crew-resource-management research and training.","Bell, H.H., & Waag, W.L. (1998). Evaluating the effectiveness of flight simulators for training combat skills: A review. International Journal of Aviation Psychology, 8(3), 223–242. https://doi.org/10.1207/s15327108ijap0803_4","This widely cited review (over 220 citations) synthesized Air Force and Navy evaluations of flight-simulator training effectiveness for combat mission skills. It identified a critical evidence gap — conclusions had rested largely on expert-opinion data with very few controlled transfer-of-training experiments — and proposed a systematic multi-step evaluation framework that has shaped subsequent military simulation training research.","Bell, H.H. (1999). The effectiveness of distributed mission training. Communications of the ACM, 42(9). https://doi.org/10.1145/306549.306573","This article synthesized early evidence that networked virtual-reality environments could support complex multi-team combat training, establishing empirical and theoretical grounding for the USAF Distributed Mission Training program. It catalysed investment in Live-Virtual-Constructive (LVC) training architectures and remains a foundational reference for networked simulation training research.","Training system design and evaluation for high-stakes aviation and defense; skill acquisition, transfer of training, and human performance. Flight-simulator training effectiveness, networked Distributed Mission Operations using Live-Virtual-Constructive simulation, and Mission Essential Competency frameworks for defining and measuring warfighter performance. Synthesized Air Force and Navy evaluations of simulator training for combat mission skills, exposing reliance on expert-opinion data and proposing a systematic multi-step transfer-of-training evaluation framework. Examined how network latency degrades perceived motion fidelity in distributed flight simulators, establishing acceptable latency thresholds. Reviewed aircrew coordination and crew-resource-management research in low-cost PC-based simulation, supporting ecological validity of desktop simulators. Grounding for networked virtual-reality multi-team combat training and team coordination.","Identity is confidently established: Herbert H. Bell, PhD (experimental psychology, Vanderbilt), former Branch Chief/Technical Director, AFRL Warfighter Readiness Research Division, currently Senior Scientist at Discerning Technologies, Mount Dora, FL. His email domain afresearchlab.com is confirmed via ZoomInfo; ResearchGate lists 61 publications. The three ""recent"" publications are the most recent peer-reviewed items I could verify; his ResearchGate profile exists (Herbert-Bell-2 / Herbert Harrington Bell) but is access-restricted. No peer-reviewed publications from 2023–2026 were identifiable — after moving to Discerning Technologies his indexed output appears to have diminished. Citation count of ~223 for the Bell and Waag 1998 paper comes from Semantic Scholar. The 2005 ""Can PC-Based Systems Enhance Teamwork"" paper is confirmed in the Taylor and Francis DOI (s15327108ijap1502_4) as International Journal of Aviation Psychology Vol 15 No 2, but the full author list could not be retrieved due to paywall; the paper is attributed to Herbert H. Bell in ResearchGate and web search summaries. The Bennett et al. 2013 Military Psychology paper is a short editorial introduction (pages 173–176) co-authored by Bell, not a full empirical article; it is the most recent peer-reviewed item I could confirm with full citation details."
