"name","rank","found","recent_1","recent_1_synopsis","recent_2","recent_2_synopsis","recent_3","recent_3_synopsis","seminal_1","seminal_1_synopsis","seminal_2","seminal_2_synopsis","expertise_overview","notes"
"Sommerich, Carolyn M.","AE","yes","Lavender, S.A., Sommerich, C.M., & Kachlan, A. (2025). A field test of the EMS LiftKit: Validating its usability, usefulness, and desirability. Applied Ergonomics, 127, 104519.","This research-to-practice study deployed 16 EMS LiftKit toolkits across five EMS organizations over 12 months, evaluating patient-handling assistive devices in real-world emergency settings. Providers rated the tools strongly on usability and usefulness, providing field validation for an intervention shown effective in prior laboratory simulations.","Fukumura, Y.E., Sommerich, C.M., Evans, K.D., & Roll, S.C. (2024). Work-Related Musculoskeletal Disorders and Associated Work Systems Factors: Are There Differences Between Sonography Practice Areas? Journal of Diagnostic Medical Sonography, 40(1), 4–18.","Using a work-systems framework, this study examined differences in work-related musculoskeletal disorder prevalence and associated risk factors across four sonography practice areas (abdominal, echocardiography, OB/GYN, vascular technology). It identified practice-area-specific risk profiles that can inform targeted ergonomic interventions for sonographers.","Lavender, S.A., Charbonnet, J., & Sommerich, C.M. (2023). Biomechanical assessment of alternative hand trucks for transporting heavy loads up and down stairs. Applied Ergonomics, 110, 104010.","This study compared spinal loading and upper extremity demands when workers used different hand truck designs to move heavy loads on stairs, a common high-risk task. Results provided biomechanical evidence to guide equipment selection and reduce injury risk in occupational settings involving stair transport.","Sommerich, C.M., McGlothlin, J.D., & Marras, W.S. (1993). Occupational risk factors associated with soft tissue disorders of the shoulder: a review of recent investigations in the literature. Ergonomics, 36(6), 697–717.","This widely cited literature review (~399 citations on Google Scholar) synthesized evidence on workplace exposure factors — including repetition, force, awkward posture, and vibration — linked to shoulder soft tissue disorders. It became a foundational reference for occupational biomechanics research on upper extremity musculoskeletal disorders and is frequently cited in epidemiological and intervention studies on work-related shoulder injuries.","Marras, W.S., & Sommerich, C.M. (1991). A three-dimensional motion model of loads on the lumbar spine: I. Model structure. Human Factors, 33(2), 123–137. [Part II: Model validation, same issue, pp. 139–149.]","This two-part paper in Human Factors (~340 citations) introduced a dynamic, three-dimensional biomechanical model capable of estimating lumbar spine loads during asymmetric lifting under workplace conditions — a significant advance over static, planar models. It became the methodological foundation for subsequent spine biomechanics research and occupational injury risk assessment tools, and is a core citation in the manual materials handling literature.","Occupational ergonomics and biomechanics, musculoskeletal disorder prevention, participatory ergonomics interventions; healthcare human factors for sonographers, radiographers, EMS providers, nurses, and home health aides. Introduced a dynamic three-dimensional biomechanical model estimating lumbar spine loads during asymmetric lifting for manual materials handling risk assessment; reviewed workplace exposure factors—repetition, force, awkward posture, vibration—linked to shoulder soft-tissue disorders. Evaluated patient-handling assistive devices for EMS providers in field settings; used a work-systems framework to map practice-area-specific musculoskeletal risk profiles across sonography specialties. Compared spinal loading and upper-extremity demands across hand truck designs for stair transport. Cognitive and workload dimensions of computer work, VDT and display ergonomics including monitor viewing angle and footrest use, and burnout and discomfort in healthcare workers.","Identification is unambiguous: Carolyn M. Sommerich is a well-documented faculty member at The Ohio State University, Department of Integrated Systems Engineering, with a Google Scholar profile (user=dp7e2JMAAAAJ), an OSU laboratory page, and confirmed service as HFES President 2022–2023 and HFES Fellow. Her Associate Editor role at Human Factors is consistent with her career standing. Citation counts for seminal papers are drawn from Google Scholar as reported via the scholar profile page (retrieved June 2026); specific counts for the 1993 shoulder paper (~399) and 1991 lumbar spine model (~340) are as reported there. The 2024 publication date for the Fukumura et al. paper reflects the SAGE journal page (published online 2023, volume 40 issue 1 dated 2024); the OSU publications list cites it as 2023 in the listing order but the journal volume/issue is 2024 — the citation here uses the journal volume year."
"Srinivasan, Divya","PR","yes","Ransing, V., Park, J., Ye, Y., Park, H., Kim, S., Du, J., & Srinivasan, D. (2025). Efficacy of Virtual Reality-Based Approach for Users to Understand the Potential Benefits and Limitations of Using Exoskeletons. Human Factors: The Journal of the Human Factors and Ergonomics Society, 67(11).","This paper developed and evaluated a VR-based module enabling workers to perform simulated manual material handling tasks and directly experience the biomechanical benefits and limitations of occupational exoskeletons. The VR approach improved perceived usefulness and helped users form realistic expectations before physical exoskeleton deployment.","Scheer, E. R., Atweh, J. A., Arora, J., Thompson, E., Petty, L., Huh, R., Murray, J., Sellers, E., Srinivasan, D., & Valdez, R. S. (2025). Designing and implementing exoskeleton devices for nurses with acute and chronic pain. Applied Ergonomics, 129, 104596.","This study examined the participatory design and implementation of back-support exoskeletons specifically for nurses experiencing musculoskeletal pain, identifying barriers related to workplace disclosure, stigma, and co-worker perceptions. Findings highlight critical human factors considerations for deploying wearable assistive technology in healthcare occupational settings.","Upasani, S., Srinivasan, D., Zhu, Q., Du, J., & Leonessa, A. (2024). Eye-Tracking in Physical Human–Robot Interaction: Mental Workload and Performance Prediction. Human Factors: The Journal of the Human Factors and Ergonomics Society, 66(8), 2104–2119.","This paper investigated whether gaze metrics captured via eye-tracking could predict mental workload and task performance during operation of a whole-body powered exoskeleton. Results demonstrated that eye-tracking-derived features are valid proxies for cognitive load in physical human–robot interaction contexts.","Srinivasan, D., & Mathiassen, S. E. (2012). Motor variability in occupational health and performance. Clinical Biomechanics, 27(10), 979–993. https://doi.org/10.1016/j.clinbiomech.2012.08.007","This highly cited review (407+ citations) synthesized evidence on intrinsic motor variability as both a window into musculoskeletal disorder risk and a potential intervention target in repetitive occupational tasks. It established the conceptual foundation for using naturally occurring biomechanical variation — rather than solely extrinsic job redesign — to reduce work-related musculoskeletal disorder risk, influencing a decade of occupational biomechanics research.","Kim, S., Moore, A., Srinivasan, D., Akanmu, A., Barr, A., Harris-Adamson, C., Rempel, D. M., & Nussbaum, M. A. (2019). Potential of exoskeleton technologies to enhance safety, health, and performance in construction: Industry perspectives and future research directions. IISE Transactions on Occupational Ergonomics and Human Factors, 7(3–4), 185–191. https://doi.org/10.1080/24725838.2018.1561557","This widely cited (254+ citations) perspective paper was among the first to systematically characterize industry stakeholder views on occupational exoskeletons in construction, identifying key barriers and research gaps around safety, usability, and acceptance. It has become a key reference for researchers and practitioners designing exoskeleton interventions for physically demanding occupations.","Occupational biomechanics, physical ergonomics, human-robot interaction; evaluating back-support and upper-extremity occupational exoskeletons in construction, nursing, surgical, and manufacturing settings. Reframed intrinsic motor variability in repetitive work as both a window into musculoskeletal disorder risk and an intervention target, reducing risk through naturally occurring biomechanical variation rather than job redesign. Characterized industry stakeholder views on construction exoskeletons, identifying barriers around safety, usability, and acceptance. Participatory design and deployment of back-support exoskeletons for nurses with musculoskeletal pain, surfacing disclosure, stigma, and co-worker perception barriers. Eye-tracking gaze metrics as proxies for mental workload during powered exoskeleton use; VR-based training to convey exoskeleton benefits and limitations; aging, gender, and disability as moderators of intervention efficacy.","Identity confidently confirmed. Divya Srinivasan (Ph.D., CPE) is a well-known ergonomics researcher and Certified Professional Ergonomist at Clemson University. She has published in Human Factors directly (at least two papers: the 2024 eye-tracking/exoskeleton paper and the 2025 VR/exoskeleton paper) and has received the HFES HFE WOMAN Woman of the Year Award (2024). Her Google Scholar h-index is 30 with 3,452 citations as of mid-2026. Citation counts for seminal works are as reported on her Scholar profile. The ""PR"" (Past/Provisional Reviewer) role is consistent with her publication profile and active engagement with HFES. No ambiguity about identity — no other prominent Divya Srinivasan in the human factors or ergonomics field was found."
"St. John, Mark F.","EB","yes","St. John, M., Stroud, T., Harris, M., Wingate, K., & Maurino, K. (2017). Cognitive Bowties: A new approach to analyzing human factors in process control. Proceedings of the Human Factors and Ergonomics Society Annual Meeting, 61(1).","Proposes a 'cognitive bowtie' framework—extending standard process-safety bowtie diagrams—to systematically map the human-factors barriers (situation awareness, communication, procedures, workload) that prevent process-control hazards. The approach is simpler than the abstraction hierarchy and more directly actionable for identifying cognitive failure points in industrial control settings.","St. John, M. F. (2015). Developing a set of human factors barriers for deepwater drilling risk assessment. Proceedings of the Offshore Technology Conference (OTC-25765-MS). Houston, TX.","Applies a structured human-factors taxonomy to deepwater drilling risk assessment, cataloguing barriers such as workload management, information presentation, communication, and team coordination that protect against well-control incidents. The paper argues that human error underlies the majority of well-control events and that explicit HF barrier modeling improves bowtie risk analyses.","St. John, M., & Smallman, H. S. (2008). Staying up to speed: Four design principles for maintaining and recovering situation awareness. Journal of Cognitive Engineering and Decision Making, 2(4), 330–355.","Derives four principled display-design guidelines—covering change logging, temporal context, multiple timescales, and team sharing—for helping operators in dynamic monitoring tasks (e.g., air defense, emergency operations) detect changes and recover situation awareness after interruptions. The framework generalizes empirical findings from the CHEX tool research into transferable design guidance.","St. John, M., Kobus, D. A., Morrison, J. G., & Schmorrow, D. (2004). Overview of the DARPA Augmented Cognition Technical Integration Experiment. International Journal of Human–Computer Interaction, 17(2), 131–149.","Describes the first large-scale empirical test of the augmented-cognition concept—using real-time psychophysiological measures (EEG, fNIRS, eye tracking, heart rate) to detect cognitive-workload states and adaptively restructure information presentation for warfighters. With approximately 180 citations, it became the canonical reference for closed-loop neuroadaptive HCI systems and spawned a subsequent generation of augmented-cognition research.","St. John, M., Smallman, H. S., Manes, D. I., Feher, B. A., & Morrison, J. G. (2005). Heuristic automation for decluttering tactical displays. Human Factors, 47(3), 509–525.","Demonstrated in a controlled naval air-defense simulation (N=27 experienced operators) that heuristic automation that intelligently strips irrelevant symbols from cluttered tactical displays improved threat-response timeliness by 25% and was overwhelmingly preferred by users. The study is influential because it provided rigorous empirical evidence for the benefit of automation-assisted decluttering in high-stakes military displays and contributed widely-cited design principles for adaptive information management.","Tactical display design, situation awareness, cognitive workload; 2D versus 3D perspectives, icon and symbol design, automated decluttering. Demonstrated heuristic automation stripping irrelevant symbols from cluttered tactical displays improved threat-response timeliness and was strongly operator-preferred. Change detection and situation-awareness recovery via the CHEX paradigm, deriving display guidelines on change logging, temporal context, multiple timescales, and team sharing; articulated the theory of Naïve Realism regarding misplaced faith in realistic visualizations. Conducted the first large-scale empirical test of augmented cognition, using real-time EEG, fNIRS, eye tracking, and heart rate to detect workload states and adaptively restructure information presentation in closed-loop neuroadaptive systems. Extended cognitive-engineering frameworks into process-safety, applying cognitive bowties to barrier analysis for deepwater drilling and industrial process control.","Identity is confidently established: this is the Mark F. St. John (PhD, Pacific Science & Engineering Group, San Diego, CA; formerly SPAWAR Systems Center San Diego) who publishes in Human Factors (SAGE), the Journal of Cognitive Engineering and Decision Making, and HFES annual meeting proceedings—all venues directly aligned with the Human Factors journal editorial board. There is a different person named Mark St. John who runs Inverness Research (education evaluation) and another who was a rock guitarist; these have been ruled out. Citation counts for the DARPA Augmented Cognition paper (~180) and the Heuristic Automation paper (~97) are drawn from the Google Scholar snippet retrieved during research and may not be current. No confirmed peer-reviewed publications after 2017 were found; the three 'recent' publications listed above are the most recent verifiable works (2015, 2017, 2008) rather than 2023–2026 works. The Naïve Realism paper (Smallman & St. John, 2005, Ergonomics in Design, 13(3), 6–13) and the 2D/3D displays paper (St. John et al., 2001, Human Factors, 43(1), 79–98) are additional high-impact works that rival the two seminal papers selected but were omitted only due to the two-paper limit."
"Stirling, Leia","PR","yes","Jeanniton, C., Baum, B. S., Edwards, H., & Stirling, L. A. (2026). Measuring the Effect of a Powered Ankle Exoskeleton on Street Crossing Decisions for Novice Users Without Mobility Limitations. Human Factors, 68(2), 180–196. https://doi.org/10.1177/00187208251369276","This study examined how wearing a powered ankle exoskeleton (Dephy ExoBoot) affects pedestrian street-crossing decisions in novice users without mobility limitations using a simulated traffic intersection on a self-paced treadmill. It found significant exoskeleton effects on crossing-decision timing, raising human factors concerns about how assistive devices alter pedestrian safety behavior in real-world environments.","Wu, M. I., Baum, B. S., Edwards, H., & Stirling, L. A. (2025). Effect of an Imperfect Algorithm on Human Gait Strategies With an Active Ankle Exoskeleton. IEEE Transactions on Human-Machine Systems, 55(1), 1–9.","This paper investigated how users adapt their gait strategies when an ankle exoskeleton controller performs imperfectly, identifying diverse emergent gait patterns through cluster analysis. The findings underscore the importance of accounting for algorithm variability in exoskeleton human factors evaluation and control design.","Weiss, H., Liu, A. M., Byon, A., Blossom, J., & Stirling, L. (2023). Comparison of Display Modality and Human-in-the-Loop Presence for On-Orbit Inspection of Spacecraft. Human Factors, 65(6), 1059–1073. https://doi.org/10.1177/00187208211042782","This controlled experiment with 19 participants assessed how 2D, 3D, and augmented reality display interfaces — and whether operators were synchronously or asynchronously in the loop — affected situation awareness, workload, and performance in telerobotic spacecraft inspection tasks. It provides empirical guidance for display and interface design in space human factors and supervisory control contexts.","Stirling, L., Kelty-Stephen, D., Fineman, R., Jones, M. L. H., Park, B.-K. D., Reed, M. P., Parham, J., & Choi, H. J. (2020). Static, Dynamic, and Cognitive Fit of Exosystems for the Human Operator. Human Factors, 62(3), 424–440. https://doi.org/10.1177/0018720819896898","This paper introduced and defined the tripartite framework of static fit (anthropometric alignment), dynamic fit (kinematic compatibility during movement), and cognitive fit (human information processing demands) as a unified lens for evaluating exosystem design. It became a foundational conceptual reference for the human factors community studying wearable exoskeletons, and served as the lead article in a special Human Factors issue on user-centered exoskeleton design.","Stirling, L., Siu, H. C., Jones, E., & Duda, K. (2019). Human Factors Considerations for Enabling Functional Use of Exosystems in Operational Environments. IEEE Systems Journal, 13(1), 1072–1083. https://doi.org/10.1109/JSYST.2018.2818668","This paper systematically applied human factors principles — spanning cognitive workload, situation awareness, motor adaptation, and trust — to the design and evaluation of exoskeleton systems in high-demand military and occupational contexts. It is widely cited as one of the first rigorous human factors frameworks targeting exosystem usability in operational (rather than clinical) settings, helping to shape subsequent HF standards and evaluation guidelines for exoskeletons.","Human factors, biomechanics, and robotics for physical-cognitive interactions in tightly coupled human-machine systems; exoskeletons and assistive wearable devices. Introduced a tripartite framework of static fit (anthropometric alignment), dynamic fit (kinematic compatibility), and cognitive fit (information processing demands) for evaluating exosystem design; applied workload, situation awareness, motor adaptation, and trust to exoskeletons in military and occupational settings. How powered ankle exoskeletons alter pedestrian street-crossing decisions, raising assistive-device safety concerns; identified emergent gait strategies when exoskeleton control performs imperfectly. Displays and controls in space supervisory control, comparing 2D, 3D, and augmented reality interfaces and synchronous versus asynchronous loop conditions on situation awareness, workload, and performance in telerobotic spacecraft inspection. Occupational ergonomics, musculoskeletal safety, and trust in wearable robotics.","Identification is confident. Leia Stirling (née Blumenthal) is a single uniquely identifiable researcher: Associate Professor at the University of Michigan IOE department, former MIT faculty (Charles Stark Draper Professorship), PhD from MIT 2008. Her role as PR (Past/Provisional Reviewer) in Human Factors is consistent with her extensive publication record in that journal (at least four peer-reviewed articles in Human Factors as of 2026). Citation counts cited here for her most-cited works are from her Google Scholar profile accessed via web search (675 citations for the 2014 Bioinspiration and Biomimetics paper on soft ankle rehabilitation device, which is a multi-author Harvard Wyss Institute collaboration with Stirling as one contributor; the 2020 Human Factors exosystem fit paper and 2019 IEEE Systems Journal paper are her most field-defining independent HF contributions). The two seminal works selected prioritize her original HF-specific theoretical contributions over multi-author soft-robotics engineering papers from the Harvard Wyss era where her contribution was one among many."
