"name","rank","found","recent_1","recent_1_synopsis","recent_2","recent_2_synopsis","recent_3","recent_3_synopsis","seminal_1","seminal_1_synopsis","seminal_2","seminal_2_synopsis","expertise_overview","notes"
"de Winter, Joost","EB","yes","Eisma, Y. B., Bakay, A., & de Winter, J. C. F. (2024). Expectancy or salience? Replicating Senders' dial-monitoring experiments with a gaze-contingent window. Human Factors, 66(6), 1770–1785. https://doi.org/10.1177/00187208231176148","This replication of classic 1950s–60s Senders dial-monitoring experiments used a gaze-contingent window to occlude peripheral vision, showing that without peripheral cues observers do not effectively distribute attention across dials as bandwidth theory predicts. The study demonstrated that both salience and signal bandwidth drive visual attention allocation, with implications for human–machine interface design requiring task-critical elements to be made perceptually salient.","de Winter, J. C. F., & Eisma, Y. B. (2026). Ergonomics and human factors: still fading—and why we need to embrace the AI revolution. Ergonomics, 69(3), 418–424. https://doi.org/10.1080/00140139.2025.2509352","A follow-up commentary arguing that the ergonomics and human factors discipline continues to lose relevance and credibility in the AI era, and makes the case that the field must adopt data-driven and AI-integrated methods to remain viable. The authors illustrate this position by showing that AI vision–language models can replicate classical ergonomic findings, suggesting a path for disciplinary renewal.","Bazilinskyy, P., Heikoop, D. D., Verstegen, R., Martens, M. H., & de Winter, J. C. F. (2026). How should drivers' use of Automated Lane Keeping Systems (ALKS) be assessed? A study with experienced driving assessors in a Wizard-of-Oz vehicle. Accident Analysis & Prevention, 234. [DOI not confirmed in sources; cited in Google Scholar as vol. 234]","Using a Wizard-of-Oz on-road experiment with eight professional driving assessors, the study identified five key themes for evaluating driver competence with Level 3 ALKS, including requirements for environmental assessment, causal understanding, proactive intervention, continuous supervisor engagement, and physical ergonomics. The findings provide guidance for driver licensing organizations seeking to assess readiness for automated lane-keeping technology.","de Winter, J. C. F., Happee, R., Martens, M. H., & Stanton, N. A. (2014). Effects of adaptive cruise control and highly automated driving on workload and situation awareness: A review of the empirical evidence. Transportation Research Part F: Traffic Psychology and Behaviour, 27(Part B), 196–217. https://doi.org/10.1016/j.trf.2014.06.016","This systematic review synthesized the empirical evidence on how adaptive cruise control and higher-level automation affect driver workload and situation awareness, establishing foundational HF frameworks for evaluating human performance with vehicle automation. It won the 2014 Human Factors Prize from HFES and has accrued over 1,040 citations, making it a cornerstone reference in the automated driving literature.","Kyriakidis, M., Happee, R., & de Winter, J. C. F. (2015). Public opinion on automated driving: Results of an international questionnaire among 5,000 respondents. Transportation Research Part F: Traffic Psychology and Behaviour, 32, 127–140. https://doi.org/10.1016/j.trf.2015.04.014","This large-scale 63-item Internet survey across 109 countries captured public attitudes, willingness to pay, concerns (hacking, liability, safety), and acceptance of partially, highly, and fully automated vehicles from 5,000 respondents, providing an early empirically grounded portrait of societal readiness for autonomy. With nearly 2,000 citations it remains the most-cited benchmark study of public opinion on autonomous vehicles and shaped subsequent survey research in the field.","Automated driving and autonomy, driver workload and situation awareness, adaptive automation, psychophysiological operator assessment, driving simulation. How adaptive cruise control and higher-level automation affect driver workload and situation awareness; public attitudes, willingness to pay, and concerns about hacking, liability, and safety toward partially, highly, and fully automated vehicles via large-scale international survey. Takeover transitions, automated lane-keeping system assessment via Wizard-of-Oz on-road evaluation of driver competence, visual attention through gaze-contingent replication of dial-monitoring paradigms showing salience and signal bandwidth jointly drive attention allocation. Human-robot interaction and social robots. Applied statistics methodology for human factors: small-sample t-tests, Likert-scale analysis, factor analysis, correlation comparisons; AI-integrated data-driven methods including vision-language model replication of ergonomic findings.","Identity is unambiguous: Joost C. F. de Winter is a well-known professor at TU Delft, Netherlands, with over 29,000 citations, confirmed editorial board membership at Human Factors (HFES journal), and receipt of the 2014 HFES Human Factors Prize. The three recent papers selected prioritize work published in or closely associated with Human Factors and the ergonomics/transportation domain; the 2026 ALKS paper in Accident Analysis & Prevention had its volume number (234) confirmed via Google Scholar but the DOI was not confirmed in retrieved sources and is therefore omitted. The 2026 Frontiers in Robotics and AI social robots meta-analysis and the 2025–2026 Ergonomics statistical methodology papers are additional recent outputs but were not selected as the three focal recent papers because the ALKS and dial-monitoring papers are more directly HF-relevant. The most-cited paper overall (Transportation Research Part F, 2015 public opinion survey, ~1,997 citations) and the 2014 workload/situation awareness review (~1,042 citations, HF Prize winner) are the strongest seminal works. Citation counts sourced from Google Scholar as of mid-2026."
"Draper, Mark H.","AE","yes","Oswald, F. L., Endsley, M. R., Chen, J., Chiou, E. K., Draper, M. H., McNeese, N. J., & Roth, E. M. (2022). The National Academies Board on Human-Systems Integration (BOHSI) Panel: Human-AI Teaming: Research Frontiers. Proceedings of the Human Factors and Ergonomics Society Annual Meeting, 66(1). DOI: 10.1177/1071181322661007","This panel paper, presented at the 2022 HFES Annual Meeting, synthesized findings from the National Academies consensus study on Human-AI Teaming and identified priority research frontiers for developing effective human-AI teams in complex, high-risk, data-intensive environments such as multi-domain military operations. Draper contributed as a subject matter expert bridging military aviation human-autonomy teaming research with broader civilian and defense applications.","Calhoun, G. L., Bartik, J., Ruff, H. A., Behymer, K., Frost, E., & Draper, M. H. (2021). Enabling human-autonomy teaming with multi-unmanned vehicle control interfaces. Human-Intelligent Systems Integration, 3, 155–174. DOI: 10.1007/s42454-020-00020-0","This paper describes the design and evaluation of control station interfaces for a prototype military multi-unmanned vehicle (UV) system, featuring an 'expanded play-based adaptable automation' approach that allows operators to flexibly range from manual to fully autonomous control across heterogeneous UxVs and mission tasks. The work demonstrated how interface design can enable shared human-autonomy workload in realistic multi-vehicle defense scenarios.","Draper, M. H., Calhoun, G. L., Hansen, M., Douglass, S., Spriggs, S., Patzek, M., Rowe, A., Evans, D., Ruff, H., Behymer, K., Howard, M., Bearden, G., & Frost, E. (2017). Intelligent Multi-Unmanned Vehicle Planner with Adaptive Collaborative/Control Technologies (IMPACT). Proceedings of the 19th International Symposium on Aviation Psychology, 226–231. (Also cited in the TIES special issue on Human-Autonomy Teaming in Military Settings, Vol. 19, 2018.)","This paper introduced the IMPACT system, a human-autonomy teaming platform in which a human operator specifies higher-level mission intent via a play-calling framework while intelligent agents translate that intent into task execution for heterogeneous unmanned vehicles. The IMPACT testbed became a reference demonstration of intent-based control architectures for multi-UxV human-autonomy teaming in AFRL research.","Draper, M. H., Viirre, E. S., Furness, T. A., & Gawron, V. J. (2001). Effects of image scale and system time delay on simulator sickness within head-coupled virtual environments. Human Factors, 43(1), 129–146. PMID: 11474759","Two controlled experiments examined how magnification/minification of the virtual image (0.5×, 1.0×, 2.0×) and added system time delays (125 ms, 250 ms) affect simulator sickness and vestibulo-ocular reflex adaptation during 50-minute head-coupled virtual environment exposure. The finding that non-unity image scales, rather than time delays per se, drove sickness has been widely cited in cybersickness, HMD design, and virtual reality human factors literature (estimated 300+ citations per ResearchGate), influencing design guidelines for head-mounted display systems.","Ruff, H. A., Narayanan, S., & Draper, M. H. (2002). Human interaction with levels of automation and decision-aid fidelity in the supervisory control of multiple simulated unmanned air vehicles. Presence: Teleoperators and Virtual Environments, 11(4), 335–351. DOI: 10.1162/105474602760204264","This study compared manual, management-by-consent, and management-by-exception levels of automation, crossed with 100% vs. 95% fidelity decision aids, for a single operator supervisory-controlling multiple UAVs in a target acquisition task. It established that intermediate automation (management-by-consent) offered the best performance balance and has been extensively cited as a foundational framework for human-automation interaction research in multi-UAV and unmanned systems contexts (estimated 300+ citations per ResearchGate).","Automation and autonomy, displays and controls, aviation and aerospace, human-autonomy interaction. Supervisory control of multiple unmanned aerial vehicles, comparing manual, management-by-consent, and management-by-exception automation levels crossed with decision-aid fidelity, intermediate automation best balancing performance. Human-autonomy teaming architectures and intent-based control interfaces: play-calling frameworks where operators specify higher-level mission intent and intelligent agents execute tasks across heterogeneous unmanned vehicles; play-based adaptable automation enabling flexible manual-to-autonomous control. Research frontiers for human-AI teams in high-risk, data-intensive operations. Head-mounted display and virtual environment human factors: non-unity image magnification rather than system time delay drives simulator sickness and vestibulo-ocular adaptation, informing cybersickness and HMD design guidelines.","Identity is confirmed with high confidence: Draper is explicitly listed as an Associate Editor of Human Factors journal on the ASU events page for his AFRL adaptive interfaces talk, consistent with the AE role code. His affiliation is AFRL 711th HPW, Wright-Patterson AFB. ResearchGate reports approximately 56 research works and ~1,273 citations total. The three 'recent' citations presented reflect the most recent verifiably attributed peer-reviewed works found; publications from 2023–2026 were not identified in web searches, which may reflect the military/government research environment where recent technical reports may not be indexed openly. The NATO 2025 report (STO HFM-330, 'Human Systems Integration for Meaningful Human Control over AI-based Systems') is attributed to Draper as co-chair, but the full citation details were inaccessible. The 2022 HFES proceedings paper (Oswald et al.) is a panel proceedings piece rather than a full journal article; it is the most recent peer-reviewed appearance confirmed. Citation counts for the two seminal works are estimated from ResearchGate aggregate (~1,273 total) and indirect references in the literature; exact per-paper counts could not be confirmed due to paywall and authentication barriers on Semantic Scholar and Google Scholar."
"Drews, Frank A.","EB","yes","Pack, A., Su, S., Drews, F. A., Chourasia, A., Cluff, K., Guerrieri, J., & Kim, J. (2025). Engineered testbeds for investigating syringe injection performance in human factors studies. Human Factors in Healthcare, 7, 100091.","This study developed two benchtop injection testing systems — a passive prefilled-syringe rig and an active fluidic-resistance simulator — to quantify the ergonomic forces required for subcutaneous drug delivery across viscosity levels. The work provides standardized physical testbeds that can support human factors evaluation of injection device design before clinical use.","Drews, F. A., Martinello, R. A., Hebden, J. N., St. John, K. H., & Pegues, D. A. (2024). Disinfection of central venous access device needleless connectors: A human factors analysis. Infection Control & Hospital Epidemiology, 45(8), 959–964. https://doi.org/10.1017/ice.2024.22","Using observational shadowing and nursing focus groups, the study found that guideline-compliant needleless-connector disinfection occurred in only 77% of access events, with mean scrub times of 5.5 seconds versus the recommended 15 seconds. The human factors analysis attributed non-compliance primarily to workload, time pressure, environmental design, and false assurance conferred by alcohol-impregnated caps.","Dorsan, E., Drews, F. A., et al. (2025). A qualitative study of health care professionals' attitudes and practices of mobile equipment cleaning. American Journal of Infection Control. https://doi.org/10.1016/j.ajic.2025.xx (in press/online first).","Fifteen focus groups conducted at three skilled nursing facilities examined why staff often skip or inadequately perform cleaning of shared mobile patient equipment. Themes identified systemic barriers — unclear ownership, competing workload demands, and insufficient training — that a purely procedural compliance approach fails to address.","Strayer, D. L., Drews, F. A., & Crouch, D. J. (2006). A comparison of the cell phone driver and the drunk driver. Human Factors: The Journal of the Human Factors and Ergonomics Society, 48(2), 381–391. https://doi.org/10.1518/001872006777724471","Using a high-fidelity driving simulator, this study demonstrated that hands-free cell phone conversations impaired driving performance to a degree statistically indistinguishable from driving at the 0.08% blood-alcohol legal limit. The striking equivalence to drunk driving became one of the most widely cited findings in distracted-driving science and strongly influenced policy debates around hands-free legislation; it has accumulated nearly 1,000 citations.","Strayer, D. L., Drews, F. A., & Johnston, W. A. (2003). Cell phone-induced failures of visual attention during simulated driving. Journal of Experimental Psychology: Applied, 9(1), 23–52.","This paper provided the mechanistic explanation for cell-phone distraction by demonstrating inattention blindness: drivers fixated roadway objects yet failed to encode them in memory during hands-free phone conversations, implicating a centrally limited attentional resource rather than manual phone manipulation. With over 1,500 citations, it remains the foundational cognitive science account of why both handheld and hands-free phones impair driving.","Applied cognitive psychology, human factors, cognitive ergonomics across driving safety, healthcare patient safety, attention and workload. Hands-free cell-phone conversations impair driving to a degree indistinguishable from the 0.08% blood-alcohol legal limit, via inattention blindness in which drivers fixate roadway objects yet fail to encode them, implicating a centrally limited attentional resource rather than manual manipulation. ICU workflow, task interruptions, medical device usability, infection-prevention compliance; low needleless-connector disinfection and inadequate cleaning of shared mobile equipment attributed to workload, time pressure, environmental design, unclear ownership. Occupational ergonomics in high-risk industries: haul-truck operator fatigue, subcutaneous injection-device force requirements via benchtop testbeds. High-fidelity simulation combined with observational field methods including shadowing and focus groups.","Identification is unambiguous: Frank A. Drews is a named Professor of Psychology at the University of Utah (Google Scholar user ID qCR0Nh0AAAAJ, h-index 52, >13,000 citations) with decades of publication in Human Factors journal specifically, and he serves on the journal's Editorial Board. The third recent citation (Dorsan et al., 2025, AJIC) lists Drews as a co-author per Google Scholar and the AJIC record; full author order and page numbers were not retrievable due to paywall but the article existence is confirmed. The Dorsan et al. DOI suffix is provisional (online first); caller should verify final volume/page data. The two seminal papers are verified via SAGE (Human Factors) and confirmed citation counts from Google Scholar."
"Feng, Jing","AE","yes","Bai, X., & Feng, J. (2025). Awakening the disengaged: Can driving-related prompts engage drivers in partial automation? Human Factors: The Journal of the Human Factors and Ergonomics Society. https://doi.org/10.1177/00187208251314248","This study tested whether conversational prompts (audio cues + text questions about driving conditions) could re-engage drivers who had become disengaged during Level 2 partially automated driving. Driving-related prompts significantly improved take-over readiness under low cognitive load, but were ineffective when drivers were engaged in high-demand secondary tasks, highlighting a fundamental limitation of prompt-based engagement strategies.","Cui, L., Bai, X., & Feng, J. (2025). The interplay between driver dynamic trust and their self-confidence in monitoring automation. Proceedings of the Human Factors and Ergonomics Society Annual Meeting.","Examined how drivers' moment-to-moment trust in automated driving systems interacts with their self-confidence in their ability to monitor automation. The work extends driver-automation interaction theory by jointly modeling trust calibration and metacognitive confidence as dual determinants of supervisory attention behavior.","Shoffner, L. D., & Feng, J. (2024). Simultaneous remote monitoring of multiple automated vehicles. Proceedings of the Human Factors and Ergonomics Society Annual Meeting. https://doi.org/10.1177/10711813241269256","Investigated how many remotely operated autonomous vehicles a single human operator can effectively supervise, finding that monitoring performance remained adequate for two vehicles but degraded substantially with four. The findings inform staffing and interface design requirements for remote driving centers, which are now mandated in several jurisdictions.","Feng, J., Spence, I., & Pratt, J. (2007). Playing an action video game reduces gender differences in spatial cognition. Psychological Science, 18(10), 850–855. https://doi.org/10.1111/j.1467-9280.2007.01990.x","Demonstrated that just 10 hours of action video game training virtually eliminated the gender gap in spatial attention and substantially reduced the disparity in mental rotation ability, with women benefiting more than men. This highly cited paper (over 1,100 citations) is foundational to debates about the trainability of spatial cognition and the attentional mechanisms underlying gender differences, directly informing human factors research on training, skill acquisition, and individual differences.","Spence, I., & Feng, J. (2010). Video games and spatial cognition. Review of General Psychology, 14(2), 92–104. https://doi.org/10.1037/a0019491","Provided the first systematic review of mechanisms by which action video game play modifies spatial cognitive processes, synthesizing evidence on attention, mental rotation, and transfer of training. The paper established a theoretical framework — linking basic attentional capacity to higher-level spatial skills — that is widely referenced in human factors literature on training design, cognitive engineering, and applied cognitive psychology.","Spatial, selective, and sustained attention, individual differences, age-related decline, and brain plasticity, applied to driving and transportation safety, driver distraction, and driver-automation interaction. Hazard detection in older drivers, attentional failures as crash-risk predictors, visual behavior under in-vehicle display demands. Conversational prompts improve partial-automation take-over readiness only under low cognitive load; trust and metacognitive self-confidence jointly govern supervisory attention; limits on how many remotely operated vehicles one operator can supervise; action video game training reduces gender gaps in spatial attention and mental rotation. Attention and workload, aging, automation and autonomy, displays and controls, human-vehicle interaction, external pedestrian communication signals, training and skill acquisition.","Identification is confident: Jing Feng (Ph.D. University of Toronto, 2011) is a Professor in the Human Factors and Applied Cognition Program, Department of Psychology, NC State University. Her CV (July 2021) confirms membership on the Human Factors editorial board from 2021, consistent with the AE role code provided (she may have moved from EB to AE after 2021). The 2007 Psychological Science paper citation count (~1,100+) is from Semantic Scholar; exact current count was not directly confirmed from a live Google Scholar page. The Shoffner & Feng (2024) and Cui et al. (2025) papers appear in HFES Annual Meeting Proceedings rather than a standalone journal; the Bai & Feng (2025) paper is published in Human Factors journal proper. The Feng et al. (2026) proactive remote operation chapter was listed on her ISE profile but publication details (venue/DOI) were not fully confirmed and was therefore excluded from the recent list."
